{
  "schema_version": 1,
  "kind": "private-head",
  "body": {
    "seq": 3,
    "parent_head_hash": "c89a641a2dc43dfda3ac4d70d67f31b692040abc4d63e419dd936ee823ea7022",
    "issued_at": 1760000120,
    "snapshot_hash": "6666666666666666666666666666666666666666666666666666666666666666",
    "logical_snapshot_hash": "2222222222222222222222222222222222222222222222222222222222222222",
    "manifest_ciphertext_sha256": "3333333333333333333333333333333333333333333333333333333333333333",
    "object_digests": [
      "4444444444444444444444444444444444444444444444444444444444444444",
      "5555555555555555555555555555555555555555555555555555555555555555",
      "7777777777777777777777777777777777777777777777777777777777777777"
    ],
    "recipient_type": "x25519",
    "next_public_key": "8139770ea87d175f56a35466c34c7ecccb8d8a91b4ee37a25df60f5b8fc9b394"
  },
  "signatures": [
    {
      "key_id": "34750f98bd59fcfc946da45aaabe933be154a4b5094e1c4abf42866505f3c97e",
      "public_key": "8a88e3dd7409f195fd52db2d3cba5d72ca6709bf1d94121bf3748801b40f6f5c",
      "signature": "ed81e6c6a5e2e1879032a04f7c1e0e6f55f753a576eed174142b1a91df7ca914811b7143d123aa78349d22b4b19fc22ff4434216257260e4f5f72adde3e7dc03"
    },
    {
      "key_id": "6a3803d5f059902a1c6dafbc9ba4729212f7caac08634cc3ae76b27529f03827",
      "public_key": "8139770ea87d175f56a35466c34c7ecccb8d8a91b4ee37a25df60f5b8fc9b394",
      "signature": "49a8c0815da9ee59efe00da4c908185e2240fe4f482aeb06e37a8da52488ada34c3c7b01453c5675aa0d311f5f873dd9ce5cb92918f662dc4998f0769111f40a"
    }
  ]
}
